{
  "schemaVersion": 1,
  "sdkVersion": "0.4.0",
  "specVersion": "1.2.0",
  "scope": "33-foundation-components",
  "common": {
    "stateOwnership": "consumer-controlled; transient state reconciles to consumer value",
    "theme": "inherit parent, merge overrides; reject malformed colors; report contrast diagnostics without recoloring",
    "direction": "ltr-or-rtl",
    "reducedMotion": "system-or-app-reduce; either request disables motion",
    "dismissReasons": [
      "confirm",
      "cancel",
      "outside",
      "escape",
      "back",
      "programmatic",
      "unmount"
    ],
    "date": {
      "calendar": "gregorian",
      "min": "0001-01-01",
      "max": "9999-12-31",
      "format": "YYYY-MM-DD",
      "timeFormat": "HH:mm",
      "timezone": "none-local-date-and-time",
      "cancel": "discard-picker-draft-not-consumer-value"
    },
    "focus": "visible; logical order; modal containment and return; nonmodal no trap",
    "platformMinimum": {
      "web": "React 18 and 19; latest 2 browser major versions",
      "android": "API 26",
      "ios": "iOS 17",
      "flutter": [
        "android",
        "ios",
        "web",
        "windows",
        "macos",
        "linux"
      ]
    },
    "platformSemantics": {
      "web": "Use the contract HTML/ARIA name, role, value and state. Semantics do not require platform default visual styles.",
      "android": "Use Compose semantics and accessibility actions, preserve editable input/IME, merge decorative child nodes, and expose errors/selection/progress; HTML and ARIA strings are Web references.",
      "ios": "Use SwiftUI accessibility names, values, traits, actions and focus. Preserve platform text editing, keyboard and safe areas; custom Rosemary visuals remain required.",
      "flutter": "Use Semantics, Focus/Actions/Shortcuts and real editable text; expose checked/mixed/enabled/selected/progress, and exclude decorative geometry. Avoid duplicate native child announcements."
    }
  },
  "components": [
    {
      "responsive": "验证长标签、窄屏、200% 文字放大和触控操作。主要信息不能因固定宽高被裁切。",
      "maturity": "implementation requires SDK acceptance",
      "validation": "SDK acceptance requires every applicable listed state, keyboard or accessibility action, light/dark/custom themes, and target-platform assistive technology. Unexecuted paths remain explicitly unverified.",
      "id": "button",
      "title": "按钮",
      "use": "执行当前界面的明确动作。导航到另一个位置时使用链接。",
      "anatomy": "容器、动作标签；图标与加载指示为可选部件。",
      "variants": "主要、次要、文本、危险；图标在文字前或后，但位置应有含义。",
      "dimensions": "桌面 32 / 40 / 48px 高度起点；触屏主要目标至少按 44px 验证；文字两侧通常 12–20px。",
      "states": "默认、悬停、按下、焦点、禁用、加载；完成和失败通过关联状态反馈。",
      "behavior": "一次激活执行一次。加载期间阻止重复提交，保持标签与宽度，明确成功或失败。",
      "keyboard": "Tab 聚焦；Enter / Space 激活。",
      "semantics": "使用原生 button。说明禁用原因；异步操作可使用 aria-busy。",
      "motion": "按下反馈约 120ms；加载指示按加载规范，不增加完成等待。",
      "good": "一个任务区域有一个主要操作，标签写“动词 + 对象”。",
      "bad": "多个操作都使用主要样式，或只用“确定”隐藏真实后果。",
      "implementation": "Rosemary rendering; no demo business data",
      "stateKeys": [
        "idle",
        "disabled",
        "busy"
      ],
      "events": [
        "activate"
      ],
      "tokenKey": "button",
      "consumerResponsibilities": [
        "business-data",
        "persistence"
      ],
      "acceptance": [
        "light-dark-custom-theme",
        "keyboard-or-platform-accessibility-actions",
        "localized-name-role-value-state",
        "200-percent-or-dynamic-type",
        "rtl-long-labels",
        "reduced-motion",
        "controlled-state",
        "lifecycle-cleanup"
      ]
    },
    {
      "responsive": "验证长标签、窄屏、200% 文字放大和触控操作。主要信息不能因固定宽高被裁切。",
      "maturity": "implementation requires SDK acceptance",
      "validation": "SDK acceptance requires every applicable listed state, keyboard or accessibility action, light/dark/custom themes, and target-platform assistive technology. Unexecuted paths remain explicitly unverified.",
      "id": "link",
      "title": "链接",
      "use": "导航到页面、资源或页面内位置。",
      "anatomy": "目标文字；必要时包含外部打开或下载说明。",
      "variants": "正文链接、导航链接、下载链接。",
      "dimensions": "点击区与行高相容；触控场景增加外围留白。",
      "states": "默认、悬停、焦点、当前页面、已访问（适用时）。",
      "behavior": "保留真实 href、浏览器返回和新标签页能力。",
      "keyboard": "Tab 聚焦，Enter 激活；不要把 Space 改成链接激活。",
      "semantics": "使用 a。当前位置用 aria-current，外部打开有必要时说明。",
      "motion": "通常只改变颜色或下划线，不移动链接文字。",
      "good": "文字说明目标，例如“查看隐私设置”。",
      "bad": "使用没有目的地的“点击这里”，或用链接执行不可逆操作。",
      "implementation": "Rosemary rendering; no demo business data",
      "stateKeys": [
        "default",
        "current",
        "visited"
      ],
      "events": [
        "navigate"
      ],
      "tokenKey": "link",
      "consumerResponsibilities": [
        "navigation-target"
      ],
      "acceptance": [
        "light-dark-custom-theme",
        "keyboard-or-platform-accessibility-actions",
        "localized-name-role-value-state",
        "200-percent-or-dynamic-type",
        "rtl-long-labels",
        "reduced-motion",
        "controlled-state",
        "lifecycle-cleanup"
      ]
    },
    {
      "responsive": "验证长标签、窄屏、200% 文字放大和触控操作。主要信息不能因固定宽高被裁切。",
      "maturity": "implementation requires SDK acceptance",
      "validation": "SDK acceptance requires every applicable listed state, keyboard or accessibility action, light/dark/custom themes, and target-platform assistive technology. Unexecuted paths remain explicitly unverified.",
      "id": "iconButton",
      "title": "图标按钮",
      "use": "空间有限且语义熟悉的独立操作。重要或陌生操作优先保留文字。",
      "anatomy": "操作区域、图标、可访问名称；提示为可选。",
      "variants": "常规、选中、危险；不把缩小按钮文字当成图标。",
      "dimensions": "图形常用 20 / 24px，操作区域与图形分开定义；触控以 44px 起验证。",
      "states": "默认、悬停、按下、焦点、禁用、选中（若为切换）。",
      "behavior": "执行与可见标签按钮相同的动作，提示不承载必要信息。",
      "keyboard": "Tab、Enter、Space；切换型使用持续选中状态。",
      "semantics": "button 必须有 aria-label 或可见文本；装饰 SVG 隐藏。",
      "motion": "轻微背景变化，不旋转或跳动图形。",
      "good": "名称写“删除记录”，而不是“垃圾桶”。",
      "bad": "仅给 SVG 加标题，按钮本身没有清楚名称。",
      "implementation": "Rosemary rendering; no demo business data",
      "stateKeys": [
        "idle",
        "disabled",
        "busy",
        "pressed"
      ],
      "events": [
        "activate",
        "pressed-change"
      ],
      "tokenKey": "iconButton",
      "consumerResponsibilities": [
        "business-data",
        "persistence"
      ],
      "acceptance": [
        "light-dark-custom-theme",
        "keyboard-or-platform-accessibility-actions",
        "localized-name-role-value-state",
        "200-percent-or-dynamic-type",
        "rtl-long-labels",
        "reduced-motion",
        "controlled-state",
        "lifecycle-cleanup"
      ]
    },
    {
      "responsive": "验证长标签、窄屏、200% 文字放大和触控操作。主要信息不能因固定宽高被裁切。",
      "maturity": "implementation requires SDK acceptance",
      "validation": "SDK acceptance requires every applicable listed state, keyboard or accessibility action, light/dark/custom themes, and target-platform assistive technology. Unexecuted paths remain explicitly unverified.",
      "id": "input",
      "title": "单行输入",
      "use": "输入一项短文本或有明确格式的值。",
      "anatomy": "持续可见标签、输入容器、值；帮助、前后缀、清除和错误信息按需出现。",
      "variants": "普通、密码、邮箱、数字语义等；使用合适的原生类型与输入法提示。",
      "dimensions": "常规高度 40–44px，正文 16px 起；宽度按预期内容确定。",
      "states": "空、聚焦、已填、只读、禁用、错误、校验中。",
      "behavior": "提交或合适时机校验；保留输入；不要在尚未输入时连续报错。",
      "keyboard": "原生文本编辑；Enter 是否提交由表单语义决定。",
      "semantics": "label 与 input 关联；帮助与错误通过 aria-describedby；错误用 aria-invalid。",
      "motion": "边界和焦点短反馈；不摇晃整个字段表示错误。",
      "good": "解释字段要求，并在字段附近给出修复方法。",
      "bad": "只用 placeholder 作标签，或失败后清空内容。",
      "implementation": "Rosemary rendering; no demo business data",
      "stateKeys": [
        "empty",
        "filled",
        "readonly",
        "disabled",
        "invalid"
      ],
      "events": [
        "value-change",
        "commit"
      ],
      "tokenKey": "input",
      "consumerResponsibilities": [
        "business-data",
        "persistence"
      ],
      "acceptance": [
        "light-dark-custom-theme",
        "keyboard-or-platform-accessibility-actions",
        "localized-name-role-value-state",
        "200-percent-or-dynamic-type",
        "rtl-long-labels",
        "reduced-motion",
        "controlled-state",
        "lifecycle-cleanup"
      ]
    },
    {
      "responsive": "验证长标签、窄屏、200% 文字放大和触控操作。主要信息不能因固定宽高被裁切。",
      "maturity": "implementation requires SDK acceptance",
      "validation": "SDK acceptance requires every applicable listed state, keyboard or accessibility action, light/dark/custom themes, and target-platform assistive technology. Unexecuted paths remain explicitly unverified.",
      "id": "textarea",
      "title": "多行输入",
      "use": "输入说明、评论或其他长度不固定的文本。",
      "anatomy": "标签、多行容器、帮助；字符限制和错误按需。",
      "variants": "固定初始行数、可调整高度、自适应高度。",
      "dimensions": "至少显示 3–4 行起点；最长高度和滚动规则明确。",
      "states": "空、聚焦、已填、只读、禁用、错误。",
      "behavior": "支持自然换行、粘贴和中断草稿；不要通过 Enter 意外提交。",
      "keyboard": "Enter 换行；快捷提交必须有可见替代并说明。",
      "semantics": "原生 textarea 与标签；字数说明不按每个字符重复播报。",
      "motion": "高度变化避免突然移动用户正在编辑的位置。",
      "good": "明确字数上限，保留用户内容和选择范围。",
      "bad": "未说明快捷键就用 Enter 发送，或自动缩小字体容纳更多字。",
      "implementation": "Rosemary rendering; no demo business data",
      "stateKeys": [
        "empty",
        "filled",
        "readonly",
        "disabled",
        "invalid"
      ],
      "events": [
        "value-change",
        "commit"
      ],
      "tokenKey": "textarea",
      "consumerResponsibilities": [
        "business-data",
        "persistence"
      ],
      "acceptance": [
        "light-dark-custom-theme",
        "keyboard-or-platform-accessibility-actions",
        "localized-name-role-value-state",
        "200-percent-or-dynamic-type",
        "rtl-long-labels",
        "reduced-motion",
        "controlled-state",
        "lifecycle-cleanup"
      ]
    },
    {
      "responsive": "验证长标签、窄屏、200% 文字放大和触控操作。主要信息不能因固定宽高被裁切。",